{"$schema":"https://github.com/Emily2040/seedance-2.0/schemas/prompt-realization-catalog.schema.json","attestation":{"linguistic_equivalence":"not_attested","locales":["en","zh-Hans"],"method":"unattested_fixture"},"entries":[{"en":"the clear glass bottle","semantic_key":"entity.bottle.label","source_sha256":"3542b184a8773dfa1b851f0ca51a49ef621f46a668b9f7044238183829257016","zh_hans":"透明玻璃瓶"},{"en":"the matte wooden tabletop","semantic_key":"entity.table.label","source_sha256":"4cb6fee7c106937c4f16c4be18a66c360ac5f6bb163e8dc8e2c4ff99956a8854","zh_hans":"哑光木质桌面"},{"en":"{entity:bottle} stands upright and still on {entity:table}","semantic_key":"event.bottle_initial.visible_state_change","source_sha256":"ab61c6e2abb9d33dfa9ceaaa4701fc10c19fe2ebd3631d667615d0b3c93ed9a0","zh_hans":"{entity:bottle}直立静止在{entity:table}上"},{"en":"{entity:bottle} begins tipping toward screen right while resting on {entity:table}","semantic_key":"event.bottle_trigger.visible_state_change","source_sha256":"ae72f0a1c0c7dfbefa099527eefff537a6e84e668984fa12546c4b2106229c6b","zh_hans":"{entity:bottle}在{entity:table}上开始向画面右侧倾倒"},{"en":"the side of {entity:bottle} makes visible contact with {entity:table}","semantic_key":"event.bottle_contact.visible_state_change","source_sha256":"8e538013537726ac878bce6c91b1bc19f99510ca81480526528584483f8c0b56","zh_hans":"{entity:bottle}的侧面与{entity:table}发生清晰可见的接触"},{"en":"after rigid contact with {entity:table}, {entity:bottle} stops moving downward and transitions into a short roll","semantic_key":"event.bottle_response.visible_state_change","source_sha256":"d731c05696d0f20d77fff627d45f429edbe125af365a2bd783ee15b93afc526c","zh_hans":"{entity:bottle}与{entity:table}发生刚性接触后停止下落，并转为短距离滚动"},{"en":"{entity:bottle} rolls a short distance across {entity:table} while the rolling speed visibly decreases","semantic_key":"event.bottle_follow.visible_state_change","source_sha256":"a557fab20c9297b1249d55ed7e548ed5a3540e190a79d95fdf64703adef36378","zh_hans":"{entity:bottle}在{entity:table}上短距离滚动，滚动速度明显减慢"},{"en":"{entity:bottle} settles on {entity:table}, fully resting on one side, and remains still","semantic_key":"event.bottle_endpoint.visible_state_change","source_sha256":"161e88a6f7ce2b6d917e81058cf9da9408ba3ad7b7f00d474204eb0723262454","zh_hans":"{entity:bottle}完全侧躺在{entity:table}上并停稳，随后保持静止"},{"en":"a medium side view framing {entity:bottle} and the short roll path","semantic_key":"shot.bottle_tip.camera.start_framing","source_sha256":"40081caa03efd322d4293db2f20d53b2a7bbe3b52c1a42a0993164c73f6b996c","zh_hans":"中景侧视，将{entity:bottle}和短距离滚动范围纳入画面"},{"en":"the camera does not translate or rotate","semantic_key":"shot.bottle_tip.camera.path","source_sha256":"7e2b6120c3d08e38ee95365d298a2889750c4fcb8fa88df7bea44adc5cbd3707","zh_hans":"镜头不平移也不旋转"},{"en":"the camera remains stationary","semantic_key":"shot.bottle_tip.camera.speed","source_sha256":"2053dbbf6ec7135c4e994d3464c478db6f48d3ca21052c8f44915edc96e02c39","zh_hans":"镜头保持静止"},{"en":"{entity:bottle} remains unobstructed within the center third of the frame","semantic_key":"shot.bottle_tip.camera.subject_relationship","source_sha256":"ab8290a0791fd35b18db22ef8eeb7c57a1f93ca6ad3b324baaf95c4c83c94d33","zh_hans":"{entity:bottle}始终无遮挡地位于画面中央三分之一范围内"},{"en":"a medium side view that keeps {entity:bottle}, now settled, fully visible","semantic_key":"shot.bottle_tip.camera.endpoint_framing","source_sha256":"5b2218b3d9b9c53cbd5a25f748b82d52c02889c70bbee40547b5f5ca81bdba4c","zh_hans":"保持中景侧视，完整呈现已静止的{entity:bottle}"},{"en":"a brief hard-object impact sound is heard when {entity:bottle} visibly strikes {entity:table}","semantic_key":"audio.contact_sound.description","source_sha256":"6420545ad3ba6b83c37b67c71200dabcf645858a8dbbc6eea91f1e615f2f0f9b","zh_hans":"当{entity:bottle}与{entity:table}发生清晰可见的撞击时，传来一声短促的硬物碰撞声"},{"en":"the silhouette and proportions of {entity:bottle} remain unchanged across the shot","semantic_key":"invariant.bottle_geometry.description","source_sha256":"dbf26fde0bf8d45802c1bb94f0ecda449f446e1512d8d945e0fed85de9c54879","zh_hans":"整个镜头中，{entity:bottle}的轮廓和比例保持不变"}],"scene_ir_sha256":"903c0f584010c943e27ae4615b486c216533d48bbd665b5554a3d010db9c0409","schema_version":1}

